{
  "external_id": "original-reading-1",
  "title": "IELTS Reading Test 1",
  "is_full_mock": false,
  "is_published": true,
  "source_provenance": {
    "origin": "original",
    "watermark": null,
    "shippable": true,
    "repaired_by": null
  },
  "sections": [
    {
      "external_id": "original-reading-1:s1",
      "kind": "reading",
      "ordinal": 1,
      "duration_seconds": 1200,
      "stimulus": {
        "type": "passage",
        "title": "The Return of the Beaver",
        "paragraphs": [
          {
            "label": null,
            "text": "For four hundred years the European beaver was absent from British rivers. It had been hunted to extinction by the sixteenth century, valued for its dense waterproof fur, for its meat, and for castoreum, a secretion once used in medicines and perfumes. Its disappearance was so complete that by the Victorian period most people regarded the animal as exotic, something belonging to Canadian forests rather than to the streams of Devon or Perthshire. The rivers themselves changed in its absence, though nobody at the time thought to record how."
          },
          {
            "label": null,
            "text": "The first legal reintroduction took place in Scotland in 2009, when eleven beavers from Norway were released into Knapdale Forest under a five-year trial. The trial was watched closely, and not only by conservationists. Farmers whose fields bordered the release site were sceptical, and some were openly hostile. A beaver can fell a mature willow in a single night, and a family group can flood several hectares of grazing land by damming a drainage ditch. These are not imagined complaints. They are the ordinary consequences of allowing a large rodent to rebuild a landscape according to its own preferences."
          },
          {
            "label": null,
            "text": "What the trial also produced was a body of measurement. Researchers recorded water chemistry above and below the new dams, counted invertebrates, and mapped the ponds that formed behind them. The results were consistent and, to many, surprising. Water leaving a beaver pond carried substantially less sediment than water entering it, because the still water allowed particles to settle. Nitrogen and phosphorus concentrations fell for the same reason. A structure built by an animal with no interest in water quality was, in effect, filtering the river."
          },
          {
            "label": null,
            "text": "The flood findings attracted more attention still. A beaver dam is not a wall but a leaky obstruction, and its effect on a river in spate is to slow the peak rather than to stop the water. On a small Devon stream monitored for five years, the arrival of a beaver family reduced peak flows during heavy rain by around thirty per cent. For a village downstream, thirty per cent can be the difference between a wet garden and a flooded kitchen. Engineered flood defences that achieve the same reduction cost a great deal and must be maintained; the beavers maintained their own."
          },
          {
            "label": null,
            "text": "None of this makes the animal straightforward to live with. The same instinct that slows a flood will block a culvert, and a blocked culvert can put a road under water. Beavers do not distinguish between a stream that needs damming and a drainage channel that a farmer dug at considerable expense. Where their ponds spread onto productive land, the loss is real and falls on one landowner while the benefit, spread across a catchment, falls on everyone else. This asymmetry, rather than any dispute about ecology, is what has made the reintroduction politically difficult."
          },
          {
            "label": null,
            "text": "Practical answers exist. A device known as a pond leveller, a pipe run through a dam and screened at the upstream end, allows water to pass at a rate the beavers cannot detect and therefore do not attempt to block. Culverts can be fenced. Trees of particular value can be wrapped in wire mesh at the base. Each of these costs money, and the argument in Britain has largely been about who should pay it rather than about whether the animal belongs. In 2022 the beaver was given legal protection in England, which settled the question of whether it could be removed without a licence, and sharpened the question of who compensates the farmer."
          },
          {
            "label": null,
            "text": "Elsewhere the transition is further advanced. Bavaria has had beavers since the 1960s and now supports more than twenty thousand of them. It also employs a network of trained volunteers who install levellers, negotiate with landowners, and, where nothing else will serve, trap and relocate a family. The scheme costs the state a modest sum each year, and its architects argue that this is simply the price of the flood protection and water treatment the animals provide without charge. The comparison is not perfect, but the accounting is at least honest about both sides."
          },
          {
            "label": null,
            "text": "What the British experience has clarified is that a reintroduction is not an ecological event with social consequences but a social arrangement with ecological consequences. The beaver will do what beavers do. Whether that is experienced as restoration or as damage depends almost entirely on whether the institutions around the river have been prepared for it."
          }
        ]
      },
      "groups": [
        {
          "external_id": "original-reading-1:s1:g1",
          "ordinal": 1,
          "instructions": "Questions 1-6\nComplete the notes below.\nChoose ONE WORD ONLY from the passage for each answer.",
          "shared_options": null,
          "questions": [
            {
              "external_id": "original-reading-1:q1",
              "ordinal": 1,
              "type": "note_completion",
              "prompt": "Beaver extinct in Britain by the ……… century",
              "options": null,
              "correct_answer": "sixteenth",
              "accepted_variants": [
                "16th",
                "the sixteenth"
              ],
              "evidence": {
                "kind": "passage",
                "paragraph_index": 0,
                "start": 115,
                "end": 124,
                "text": "sixteenth"
              }
            },
            {
              "external_id": "original-reading-1:q2",
              "ordinal": 2,
              "type": "note_completion",
              "prompt": "Hunted for fur, meat and ………, used in medicines and perfumes",
              "options": null,
              "correct_answer": "castoreum",
              "accepted_variants": [],
              "evidence": {
                "kind": "passage",
                "paragraph_index": 0,
                "start": 193,
                "end": 202,
                "text": "castoreum"
              }
            },
            {
              "external_id": "original-reading-1:q3",
              "ordinal": 3,
              "type": "note_completion",
              "prompt": "First legal reintroduction: 2009, at Knapdale Forest, using animals from ………",
              "options": null,
              "correct_answer": "Norway",
              "accepted_variants": [],
              "evidence": {
                "kind": "passage",
                "paragraph_index": 1,
                "start": 88,
                "end": 94,
                "text": "Norway"
              }
            },
            {
              "external_id": "original-reading-1:q4",
              "ordinal": 4,
              "type": "note_completion",
              "prompt": "Water leaving a beaver pond carried less ……… than water entering it",
              "options": null,
              "correct_answer": "sediment",
              "accepted_variants": [],
              "evidence": {
                "kind": "passage",
                "paragraph_index": 2,
                "start": 301,
                "end": 309,
                "text": "sediment"
              }
            },
            {
              "external_id": "original-reading-1:q5",
              "ordinal": 5,
              "type": "note_completion",
              "prompt": "A pipe run through a dam is called a pond ………",
              "options": null,
              "correct_answer": "leveller",
              "accepted_variants": [
                "leveler",
                "pond leveller",
                "pond leveler"
              ],
              "evidence": null
            },
            {
              "external_id": "original-reading-1:q6",
              "ordinal": 6,
              "type": "note_completion",
              "prompt": "In Bavaria, trained ……… install the devices and negotiate with landowners",
              "options": null,
              "correct_answer": "volunteers",
              "accepted_variants": [
                "volunteer"
              ],
              "evidence": {
                "kind": "passage",
                "paragraph_index": 6,
                "start": 175,
                "end": 185,
                "text": "volunteers"
              }
            }
          ]
        },
        {
          "external_id": "original-reading-1:s1:g2",
          "ordinal": 2,
          "instructions": "Questions 7-13\nDo the following statements agree with the information given in Reading Passage 1?\nWrite TRUE if the statement agrees with the information, FALSE if the statement contradicts the information, or NOT GIVEN if there is no information on this.",
          "shared_options": [
            {
              "label": "TRUE",
              "text": ""
            },
            {
              "label": "FALSE",
              "text": ""
            },
            {
              "label": "NOT GIVEN",
              "text": ""
            }
          ],